{
  "$schema": "https://json-schema.org/draft/2020-12/schema",
  "$id": "observed-state-snapshot.schema.json",
  "title": "Observed State Snapshot",
  "description": "An observed state with required provenance. Observation does not replace a declaration. authority_effect remains NONE.",
  "type": "object",
  "additionalProperties": false,
  "properties": {
    "schema_version": {
      "type": "string",
      "const": "1.0.0",
      "minLength": 1
    },
    "snapshot_id": {
      "type": "string",
      "minLength": 1
    },
    "subject_id": {
      "type": "string",
      "minLength": 1
    },
    "configuration_digest": {
      "type": "string",
      "pattern": "^sha256:[a-f0-9]{64}$"
    },
    "statement": {
      "type": "string",
      "minLength": 1
    },
    "provenance": {
      "type": "object",
      "additionalProperties": false,
      "required": [
        "source",
        "method",
        "observed_at"
      ],
      "properties": {
        "source": {
          "type": "string",
          "minLength": 1
        },
        "method": {
          "type": "string",
          "minLength": 1
        },
        "observed_at": {
          "type": "string",
          "pattern": "^\\d{4}-\\d{2}-\\d{2}T\\d{2}:\\d{2}:\\d{2}Z$"
        }
      }
    },
    "reference_only": {
      "type": "boolean",
      "const": true
    },
    "authority_effect": {
      "type": "string",
      "const": "NONE",
      "minLength": 1
    }
  },
  "required": [
    "schema_version",
    "snapshot_id",
    "subject_id",
    "configuration_digest",
    "statement",
    "provenance",
    "reference_only",
    "authority_effect"
  ]
}
