{
  "schema_version": "1.0.0",
  "snapshot_id": "observed-synthetic-001",
  "subject_id": "synthetic-subject-alpha",
  "configuration_digest": "sha256:abababababababababababababababababababababababababababababababab",
  "statement": "observed synthetic baseline",
  "provenance": {
    "source": "synthetic-observer",
    "method": "bounded observation",
    "observed_at": "2026-10-15T00:00:00Z"
  },
  "reference_only": true,
  "authority_effect": "NONE"
}
